title,date,author,url,article
Ini Kandungan Skincare untuk Mengatasi Jerawat Papula,2024-06-09,Redaksi Halodoc,https://www.halodoc.com/artikel/ini-kandungan-skincare-untuk-mengatasi-jerawat-papula,"Ini Kandungan Skincare untuk Mengatasi Jerawat Papula
“Jerawat papula berwarna kemerahan dan meradang. Jenis jerawat ini bisa diatasi dengan beberapa jenis kandungan yang ada dalam skin care.”
DAFTAR ISI
- Apa Penyebab Jerawat Papula?
- Kandungan Skincare untuk Mengobati Jerawat Papula
- Hubungi Dokter Ini untuk Tips Mengatasi Jerawat Papula
Halodoc, Jakarta – Jerawat papula adalah benjolan padat yang meradang pada kulit dengan ujung berisi nanah berwarna putih atau kuning. Ukurannya tak lebih dari 1 sentimeter dan berwarna kemerahan.
Ketimbang jenis lainnya, jerawat papula lebih sulit teratasi. Namun, ada beberapa bahan aktif pada skincare yang mampu mengobati jenis jerawat yang meradang ini.
Apa Penyebab Jerawat Papula?
Sama dengan penyebab jerawat pada umumnya, papula terjadi karena pori-pori wajah yang tersumbat akibat produksi sebum atau minyak berlebih dan penumpukan sel kulit mati.
Kulit manusia mempunyai kelenjar minyak yang menghasilkan sebum, fungsi utamanya untuk membantu menjaga kulit agar tetap lembap.
Akan tetapi, ada beberapa kondisi yang bisa membuat aktivitas kelenjar ini meningkat sehingga produksi minyak pada wajah menjadi berlebih. Selain itu, kulit juga terus melakukan regenerasi untuk mengganti sel yang sudah tua dan rusak dengan sel baru yang lebih sehat.
Namun, sel kulit mati yang seharusnya terangkat dari wajah justru menumpuk dan mengendap pada lapisan kulit wajah paling luar. Penumpukan berlebihan ini akan membuat pori-pori kulit tertutup, semakin banyak penumpukan akan membuat sel yang ada pada area sekitarnya akan mendapat tekanan.
Semakin besar tekanan, pori kulit sekitar akan robek dan rusak. Kondisi ini akan menyebabkan isi jerawat yang mengandung bakteri memicu munculnya infeksi pada area sekitar pori kulit yang robek. Alhasil, muncul benjolan berwarna merah yang meradang.
Selain itu, kondisi berikut ini juga bisa memicu munculnya jerawat papula, yaitu:
- Peningkatan bakteri kulit akibat tidak menjaga kebersihan dengan baik.
- Peningkatan hormon androgen pubertas.
- Penggunaan obat-obatan, termasuk kortikosteroid dan steroid anabolik.
- Stres yang tak teratasi dengan baik
- Pola makan yang salah, seperti mengkonsumsi terlalu banyak gula.
Namun, kamu tak perlu khawatir, karena jenis jerawat ini dapat teratasi dengan baik menggunakan skincare dari bahan yang tepat. Kamu bisa memakainya secara teratur sebagai tahap awal mengatasi jerawat papula.
Masalah jerawat bisa muncul akibat penggunaan skincare dengan tahapan yang salah. Ikuti tahapan yang sesuai di sini: Begini Tahapan Basic Skincare dan Rekomendasi Produknya
Kandungan Skincare untuk Mengobati Jerawat Papula
Jika ingin membeli skincare untuk mengobati jerawat, sebaiknya pilih yang mengandung beberapa bahan aktif, seperti sulfur, benzoil peroksida, dan asam salisilat.
Kamu bisa bertanya terlebih dulu dengan dokter spesialis kulit terkait dengan bahan yang cocok sesuai dengan jenis kulit. Ini beberapa zat yang efektif mengatasi papula jerawat:
1. Sulfur
Sulfur atau belerang juga bisa menjadi solusi jitu mengatasi jerawat, komedo, atau kombinasi keduanya. Kamu bisa menemukan kandungan ini dalam produk perawatan kulit, seperti sabun, pembersih, losion, dan masker.
Produk belerang umumnya bisa kamu gabungkan dengan resorsinol atau sodium sulfacetamide. Bahan-bahan tersebut bersifat antiperadangan dan melembapkan sehingga ampuh untuk mengobati jerawat papula.
Kamu bisa memakainya sendiri atau bersamaan dengan produk perawatan lainnya. Mengkombinasikannya dapat membantu menghilangkan jerawat lebih cepat. Namun, waspadai risiko efek samping yang bisa terjadi.
Pasalnya, sulfur dapat membuat kulit menjadi kering, mengelupas, kemerahan, dan gatal. Efek ini biasanya terasa saat pertama kali memulai perawatan dengan belerang.
Selain itu, sulfur cenderung menimbulkan bau yang khas, yang mungkin membuat kurang nyaman pada sebagian orang. Sementara itu, jika kamu memiliki kulit sensitif, gunakan sulfur dengan dosis rendah terlebih dahulu, lalu tingkatkan secara perlahan.
Ingin mengetahui keunggulan sulfur dalam skincare, berikut 5 Manfaat Sulfur pada Skincare untuk Atasi Jerawat yang bisa kamu baca.
2. Benzoil Peroksida
Propionibacterium acnes adalah jenis bakteri penyebab jerawat yang tidak bisa hidup pada lingkungan yang kaya oksigen. Sementara itu, benzoil peroksida bekerja dengan memasukkan oksigen ke dalam pori-pori.
Tujuan utamanya adalah membunuh Propionibacterium acnes. Ketika jumlah bakteri berkurang, jerawat pada kulit akan mengalami penurunan yang signifikan.
Selain itu, benzoil peroksida juga bekerja dengan membersihkan pori-pori. Namun, setelah jerawat menghilang, kamu perlu melanjutkan perawatan dengan zat ini supaya bakteri tidak kembali menyumbat pori-pori.
Jika ingin menggunakannya, sebaiknya pakai produk yang mengandung 2,5 persen benzoil peroksida terlebih dahulu sebagai langkah awal. Kamu bisa meningkatkan persentasenya secara perlahan.
Sebab, kandungan yang terlalu tinggi bisa memicu iritasi sehingga kamu perlu memakainya secara hati-hati. Salah satu efek samping yang paling sering terjadi adalah kulit kering dan mengelupas.
Namun, efek tersebut bisa berkurang dengan menggunakan produk pelembap yang bebas minyak. Efek samping lainnya, yaitu pengelupasan yang berlebihan, kemerahan, rasa terbakar, gatal, bengkak, dan ruam.
3. Asam salisilat
Cara mengatasi jerawat papula juga bisa menggunakan skincare yang mengandung asam salisilat. Kandungan ini mampu menembus pori-pori kulit wajah dan mendorong keluarnya sel-sel kulit mati yang tersumbat.
Selain membersihkan pori-pori, asam salisilat juga dapat mengurangi kelebihan minyak pada kulit. Zat aktif ini tersedia dalam berbagai bentuk, mulai dari gel, lotion, krim, salep, sabun hingga toner.
Kamu bisa menggunakan produk ini sesuai petunjuk yang tertera pada label kemasan. Beberapa yang harus kamu perhatikan saat menggunakan asam salisilat, yaitu:
- Hindari menggunakannya jika punya riwayat alergi terhadap asam salisilat maupun salah satu bahan dalam produk asam salisilat.
- Tidak menggunakan sabun atau pembersih yang bersifat abrasif, produk yang mengandung alkohol dan obat jerawat lain yang berisiko menyebabkan iritasi.
- Sebaiknya, kamu tidak menggunakannya bersama dengan benzoil peroksida dan tretinoin.
Selain jerawat papula, komedo juga menjadi masalah umum yang terjadi pada semua orang. Untuk menghilangkannya, kamu bisa cari tahu caranya dari artikel ini: 7 Cara Simpel Menghilangkan Komedo Putih pada Wajah.
Hubungi Dokter Ini untuk Tips Mengatasi Jerawat Papula
Jika kamu butuh saran seputar jerawat papula, hubungi dokter kulit di Halodoc saja.
Berikut dokter spesialis kulit yang sudah memiliki pengalaman lebih dari 8 tahun.
Mereka juga mempunyai rating yang baik dari para pasien yang sebelumnya mereka layani di Halodoc.
Ini daftarnya:
1. dr. Dyah Ayu Nirmalasari Sp.D.V.E
Dokter Dyah Ayu Nirmalasari Sp.D.V.E merupakan lulusan Fakultas Kedokteran Universitas Muhammadiyah Yogyakarta pada 2013 dan Universitas Hasanuddin pada 2022.
Saat ini, dokter Dyah sedang menjalani praktik di Kabupaten Bima, Nusa Tenggara Barat, dan tergabung sebagai anggota Perhimpunan Dokter Spesialis Kulit dan Kelamin Indonesia (PERDOSKI).
Berpengalaman sebagai dokter spesialis kulit selama 10 tahun, dr. Dyah Ayu Nirmalasari Sp.D.V.E mampu memberikan layanan konsultasi di Halodoc terkait jerawat papula.
Chat dr. Dyah Ayu Nirmalasari Sp.D.V.E dari Rp 55.000,- di Halodoc.
2. dr. Made Martina W. M.Biomed, Sp.D.V.E
Kamu juga bisa menghubungi Made Martina W. M.Biomed, Sp.D.V.E. Ia merupakan alumnus Fakultas Kedokteran Universitas Wijaya Kusuma Surabaya pada 2011 dan Universitas Udayana pada 2017.
Ia kini berpraktik di Denpasar, Bali dan tergabung sebagai tergabung sebagai anggota Perhimpunan Dokter Spesialis Kulit dan Kelamin Indonesia (PERDOSKI).
Berbekal pengalaman selama 12 tahun, dr. Made Martina W. M.Biomed, Sp.D.V.E memberikan layanan konsultasi di Halodoc seputar mengatasi jerawat papula.
Chat dr. Made Martina W. M.Biomed, Sp.D.V.E mulai dari Rp 55.000,- di Halodoc.
3. dr. Dina Febriani Sp.D.V.E
Rekomendasi selanjutnya adalah dr. Dina Febriani Sp.D.V.E. Ia merupakan lulusan Fakultas Kedokteran Universitas Yarsi Jakarta pada 2009 dan Universitas Sebelas Maret Surakarta pada 2023.
Dokter Dina Febriani Sp.D.V.E saat ini berpraktik di Pekanbaru, Riau dan tergabung sebagai tergabung sebagai anggota Perhimpunan Dokter Spesialis Kulit dan Kelamin Indonesia (PERDOSKI).
Dengan pengalaman selama 14 tahun yang ia miliki, dr. Dina Febriani Sp.D.V.E memberikan layanan konsultasi di Halodoc tentang jerawat papula.
Chat dr. Dina Febriani Sp.D.V.E mulai dari Rp 55.000,- di Halodoc.
4. dr. Frieda Sp.D.V.E
Dokter kulit lain yang bisa kamu hubungi adalah dr. Frieda Sp.D.V.E. Ia merupakan alumnus Fakultas Kedokteran Universitas Atma Jaya pada 2015 dan Universitas Sebelas Maret pada 2022.
Ia kini berpraktik di Bogor, Jawa Barat dan tergabung sebagai tergabung sebagai anggota Perhimpunan Dokter Spesialis Kulit dan Kelamin Indonesia (PERDOSKI).
Memiliki pengalaman selama 8 tahun, dr. Frieda Sp.D.V.E memberikan layanan konsultasi di Halodoc tentang penanganan jerawat papula.
Chat dr. Frieda Sp.D.V.E mulai dari Rp 55.000,- di Halodoc.
5. dr. Ryski Meilia Novarina Sp.D.V.E
Rekomendasi dokter lain yang bisa kamu hubungi yaitu, dr. Ryski Meilia Novarina Sp.D.V.E.
Ia merupakan lulusan Fakultas Kedokteran Universitas Muhammadiyah Malang pada 2010 dan Universitas Airlangga pada 2016.
Dokter Ryski saat ini berpraktik di Gresik, Jawa Timur dan tergabung sebagai tergabung sebagai anggota Perhimpunan Dokter Spesialis Kulit dan Kelamin Indonesia (PERDOSKI).
Berbekal pengalaman selama 13 tahun, dr. Ryski Meilia Novarina Sp.D.V.E memberikan layanan konsultasi di Halodoc seputar cara mengobati jerawat papula.
Chat dr. Ryski Meilia Novarina Sp.D.V.E mulai dari Rp 55.000,- di Halodoc.
Itulah berbagai daftar dokter spesialis kulit yang bisa kamu hubungi untuk bertanya seputar jerawat papula.
Tak perlu khawatir jika dokter sedang tidak tersedia atau offline.
Sebab, kamu tetap bisa membuat janji konsultasi di lain waktu melalui aplikasi Halodoc.
Kamu juga bisa temukan produk skincare, mulai dari pembersih wajah hingga serum untuk mengatasi jerawat di Toko Kesehatan Halodoc berikut ini:
Referensi:
Very Well Health. Diakses pada 2023. Acne Papules Causes and Treatments.
Cleveland Clinic. Diakses pada 2023. Acne Papules.
American Academy of Dermatology. Diakses pada 2023. HOW TO TREAT DIFFERENT TYPES OF ACNE.
Verywell Health. Diakses pada 2023. Salicylic Acid Acne Treatments.
Verywell Health. Diakses pada 2023. Benzoyl Peroxide for Acne Treatment.
Verywell Health. Diakses pada 2023. Treating Acne With Sulfur.
Berlangganan Artikel Halodoc
Topik Terkini
Mulai Rp50 Ribu! Bisa Konsultasi dengan Ahli seputar Kesehatan"
Seputar Jerawat Papula Beserta Penyebab dan Cara Mengatasinya,2023-11-10,,https://www.alodokter.com/jerawat-papula-ciri-ciri-dan-cara-mengatasinya,"Jerawat papula adalah jerawat yang menonjol, kecil, padat, tampak kemerahan, dan tidak mengandung nanah. Meski bukanlah kondisi yang serius, jerawat ini dapat mengganggu penampilan. Namun, Anda tidak perlu khawatir, karena ada berbagai cara untuk mengatasinya.
Sama seperti jerawat pada umumnya, jerawat papula muncul karena penyumbatan dan peradangan di pori-pori wajah. Jerawat ini ditandai dengan munculnya benjolan padat dengan ukuran kurang dari 1 cm. Tak hanya di wajah, jerawat ini juga bisa muncul di dada dan punggung menyerupai jerawat pasir.
Penyebab Jerawat Papula
Munculnya jerawat papula bisa disebabkan oleh berbagai faktor atau kondisi yang memengaruhi kulit, seperti:
- Pengaruh hormonal
- Infeksi bakteri Propionibacterium acnes di permukaan kulit akibat pori-pori tersumbat
- Produksi minyak di wajah yang berlebih
- Penyumbatan di folikel rambut dan kelenjar minyak
- Terlalu banyak konsumsi makanan manis
- Stres
Selain itu, ada beberapa hal lain yang dapat memicu timbulnya jerawat papula, mulai dari konsumsi obat tertentu seperti kortikosteroid, penggunaan kosmetik, hingga tidak menjaga kebersihan kulit. Kondisi medis tertentu, seperti dermatitis kontak dan eksim, juga bisa memicu munculnya jerawat papula.
Cara Mengatasi Jerawat Papula
Jerawat papula dapat diatasi dengan berbagai perawatan sederhana di rumah, seperti:
1. Membersihkan kulit wajah secara rutin
Untuk mengatasi jerawat papula, Anda disarankan untuk membersihkan kulit wajah dan tubuh secara rutin, yaitu minimal 2 kali sehari. Tak hanya itu, mencuci wajah terlalu sering juga tidak disarankan karena bisa memicu terjadinya iritasi, peningkatan produksi minyak, dan akhirnya membuat jerawat papula semakin banyak.
2. Menggunakan pembersih wajah yang tepat
Selain mencuci wajah secara rutin, pilihlah pembersih wajah yang tepat. Pembersih wajah yang mengandung asam salisilat, benzoil peroksida, atau sulfur merupakan pilihan pembersih wajah yang baik untuk kulit berjerawat.
Kandungan-kandungan tersebut mampu menjaga pori-pori tetap bersih dan menghilangkan sel-sel kulit mati, sehingga dapat membantu proses penyembuhan jerawat papula.
3. Menghentikan kebiasaan memencet jerawat
Sama dengan jenis jerawat lainnya, hindari menyentuh, menggaruk, maupun memecahkan jerawat papula sendiri. Tindakan ini bisa membuat jerawat semakin meradang dan menyebabkan luka di permukaan kulit, sehingga dapat memicu terbentuknya bekas jerawat.
4. Menghindari penggunaan make up di area kulit yang berjerawat
Hindari menggunakan losion ataupun make up di area tubuh yang terkena jerawat, karena bisa menambah sumbatan di pori-pori. Selain itu, hindari pula menggunakan produk yang belum pernah digunakan sebelumnya. Bila ternyata tidak cocok, produk tersebut justru bisa menyebabkan iritasi yang memperparah jerawat papula.
5. Menjaga kebersihan rambut
Bersihkan rambut secara rutin menggunakan sampo, terutama jika Anda memiliki jenis rambut berminyak. Selain itu, hindari model rambut berponi karena tertutupnya permukaan kulit wajah bisa membuat jerawat semakin parah dan memicu munculnya jerawat papula baru.
Jika berbagai cara di atas belum berhasil mengatasi jerawat papula, Anda dapat berkonsultasi dengan dokter. Dokter bisa memberikan pengobatan yang tepat untuk mengatasi jerawat papula. Beberapa obat yang biasanya diberikan adalah antibiotik dan retinoid."
5 Kandungan Skincare yang Aman untuk Mengatasi Jerawat Papula,2023-11-15,Fimela com; Kezia Prasetya Christvidya,https://www.fimela.com/beauty/read/5442093/5-kandungan-skincare-yang-aman-untuk-mengatasi-jerawat-papula,"Fimela.com, Jakarta Jerawat adalah masalah kulit yang sangat umum dialami oleh berbagai usia, mulai dari usia remaja yang mengalami pubertas hingga usia dewasa, salah satunya adalah jerawat papula yang muncul dan menyebabkan peradangan ringan pada kulit.
Jerawat papula disebabkan karena pori-pori tersumbat sel kulit mati dan produksi minyak wajah yang berlebih. Jerawat ini tidak memiliki nanah seperti jerawat pada umumnya. Biasanya jerawat ini muncul dengan bentuk yang kecil dan mengalami peradangan ringan.
Jerawat papula bisa meradang dan menyebabkan kulit menjadi kemerahan, akibat adanya aktivitas bakteri di dalam lapisan kulit. Berikut kandungan skincare yang aman untuk mengatasi jerawat papula, dilansir dari berbagai sumber:
Advertisement
Advertisement
Alpha Hydroxy Acid
Kandungan skincare yang pertama untuk mengatasi jerawat papula, yaitu kandungan alpha hydroxy acid atau AHA yang biasanya terdapat di dalam produk toner. Kandungan AHA memiliki sifat sebagai eksfoliator yang aman untuk kulit berjerawat.
AHA berfungsi untuk mengangkat sel kulit mati yang menyumbat pori-pori. Karena jerawat papula disebabkan karena pori-pori yang tersumbat, akibat sel kulit mati dan produksi minyak yang berlebih.
AHA juga bisa membersihkan komedo, menghaluskan tekstur kulit yang kasar, menyembuhkan peradangan jerawat papula dan menghilangkan bekas jerawat papula.
Beta Hydroxy Acid
Hampir sama dengan AHA, beta hydroxy acid atau BHA adalah kandungan yang berfungsi sebagai eksfoliator, yang bisa mengurangi peradangan pada jerawat papula dan mengeringkan jerawat.
Kandungan BHA ini bisa membantu mengontrol produksi minyak yang berlebih. Karena pada umumnya, jerawat papula disebabkan karena kulit wajah terlalu berminyak dan minyak tersebut menyumbat pori-pori.
Selain itu, BHA juga bisa membantu mengatasi peradangan pada jerawat, membunuh bakteri penyebab jerawat dan menghilangkan bekas jerawat.
Advertisement
Niacinamide
Niacinamide adalah kandungan bahan aktif skincare yang merupakan turunan dari vitamin B3. Kandungan ini biasanya terdapat di dalam toner, serum dan juga pelembap yang diformulasikan untuk menyembuhkan jerawat.
Kandungan ini bisa membantu mengendalikan produksi minyak di kulit wajah, sehingga produksi minyak di kulit wajah lebih terkontrol, tidak menyumbat pori-pori, serta tetap meneybabkan kulit wajah lembap agar kulit tidak kering.
Karena pada dasarnya, jerawat juga bisa muncul pada kulit yang kering. Selain membantu mengontrol minyak, niacinamide juga membantu menyamarkan bekas jerawat.
Retinol
Kandungan skincare yang aman untuk mengatasi jerawat papula selanjutnya, yaitu kandungan bahan aktif retinol yang formulanya bisa melindungi skin barrier, serta mencegah tanda-tanda penuaan dini pada kulit.
Retinol bisa membantu membersihkan pori-pori, membunuh kuman atau bakteri penyebab jerawat, meregenerasi kulit dan menenangkan kulit yang meradang.
Penggunaan retinol harus sangat hati-hati karena konsentrasinya yang keras. Gunakan produk ini pada malam hari, maksimal 2 hingga 3 kali dalam seminggu. Hindari penggunaan AHA dan BHA secara bersamaan.
Advertisement
Zinc
Kandungan skincare yang aman untuk mengatasi jerawat papula yang terakhir, yaitu kandungan bahan aktif berupa zinc, yang bisa mengendalikan produksi minyak pada kulit.
Kandungan zinc ini bisa mencegah penyumbatan pada pori-pori yang menyebabkan timbulnya jerawat papula, mempercepat penyembuhan luka, mengurangi peradangan akibat jerawat dan membantu membuat kulit wajah tetap lembap.
Kandungan ini bisa membantu memperkuat sel kulit agar tidak mudah rusak karena radikal bebas, membantu membentukan membran protein pada kulit, melindungi kulit dari sinar matahari dan menghilangkan bekas jerawat."
